{
  "symbol": "NTPC",
  "dates": [
    "2026-02-20",
    "2026-02-21",
    "2026-02-22",
    "2026-02-23",
    "2026-02-24",
    "2026-02-25",
    "2026-02-26",
    "2026-02-27",
    "2026-02-28",
    "2026-03-01",
    "2026-03-02",
    "2026-03-03",
    "2026-03-04",
    "2026-03-05",
    "2026-03-06",
    "2026-03-07",
    "2026-03-08",
    "2026-03-09",
    "2026-03-10",
    "2026-03-11",
    "2026-03-12",
    "2026-03-13",
    "2026-03-14",
    "2026-03-15",
    "2026-03-16",
    "2026-03-17",
    "2026-03-18",
    "2026-03-19",
    "2026-03-20",
    "2026-03-21",
    "2026-03-22",
    "2026-03-23",
    "2026-03-24",
    "2026-03-25",
    "2026-03-26",
    "2026-03-27",
    "2026-03-28",
    "2026-03-29",
    "2026-03-30",
    "2026-03-31",
    "2026-04-01",
    "2026-04-02",
    "2026-04-03",
    "2026-04-04",
    "2026-04-05",
    "2026-04-06",
    "2026-04-07",
    "2026-04-08",
    "2026-04-09",
    "2026-04-10",
    "2026-04-11",
    "2026-04-12",
    "2026-04-13",
    "2026-04-14",
    "2026-04-15",
    "2026-04-16",
    "2026-04-17",
    "2026-04-18",
    "2026-04-19",
    "2026-04-20",
    "2026-04-21",
    "2026-04-22",
    "2026-04-23",
    "2026-04-24",
    "2026-04-25",
    "2026-04-26",
    "2026-04-27",
    "2026-04-28",
    "2026-04-29",
    "2026-04-30",
    "2026-05-01",
    "2026-05-02",
    "2026-05-03",
    "2026-05-04",
    "2026-05-05",
    "2026-05-06",
    "2026-05-07",
    "2026-05-08",
    "2026-05-09",
    "2026-05-10",
    "2026-05-11",
    "2026-05-12",
    "2026-05-13",
    "2026-05-14",
    "2026-05-15",
    "2026-05-16",
    "2026-05-17",
    "2026-05-18",
    "2026-05-19",
    "2026-05-20",
    "2026-05-21",
    "2026-05-22",
    "2026-05-23",
    "2026-05-24",
    "2026-05-25",
    "2026-05-26",
    "2026-05-27",
    "2026-05-28",
    "2026-05-29",
    "2026-05-30",
    "2026-05-31",
    "2026-06-01",
    "2026-06-02",
    "2026-06-03",
    "2026-06-04",
    "2026-06-05",
    "2026-06-06",
    "2026-06-07",
    "2026-06-08",
    "2026-06-09",
    "2026-06-10",
    "2026-06-11",
    "2026-06-12",
    "2026-06-13",
    "2026-06-14",
    "2026-06-15",
    "2026-06-16",
    "2026-06-17",
    "2026-06-18",
    "2026-06-19",
    "2026-06-20",
    "2026-06-21",
    "2026-06-22",
    "2026-06-23",
    "2026-06-24",
    "2026-06-25",
    "2026-06-26",
    "2026-06-27",
    "2026-06-28",
    "2026-06-29",
    "2026-06-30",
    "2026-07-01",
    "2026-07-02",
    "2026-07-03",
    "2026-07-04",
    "2026-07-05",
    "2026-07-06",
    "2026-07-07",
    "2026-07-08",
    "2026-07-09",
    "2026-07-10",
    "2026-07-11",
    "2026-07-12",
    "2026-07-13",
    "2026-07-14",
    "2026-07-15",
    "2026-07-16",
    "2026-07-17",
    "2026-07-18",
    "2026-07-19",
    "2026-07-20",
    "2026-07-21",
    "2026-07-22",
    "2026-07-23",
    "2026-07-24",
    "2026-07-25",
    "2026-07-26",
    "2026-07-27",
    "2026-07-28",
    "2026-07-29",
    "2026-07-30",
    "2026-07-31",
    "2026-08-01",
    "2026-08-02",
    "2026-08-03",
    "2026-08-04",
    "2026-08-05",
    "2026-08-06",
    "2026-08-07",
    "2026-08-08",
    "2026-08-09",
    "2026-08-10",
    "2026-08-11",
    "2026-08-12",
    "2026-08-13",
    "2026-08-14",
    "2026-08-15",
    "2026-08-16",
    "2026-08-17",
    "2026-08-18",
    "2026-08-19",
    "2026-08-20",
    "2026-08-21",
    "2026-08-22",
    "2026-08-23",
    "2026-08-24",
    "2026-08-25",
    "2026-08-26",
    "2026-08-27",
    "2026-08-28",
    "2026-08-29",
    "2026-08-30",
    "2026-08-31",
    "2026-09-01",
    "2026-09-02",
    "2026-09-03",
    "2026-09-04",
    "2026-09-05",
    "2026-09-06",
    "2026-09-07",
    "2026-09-08",
    "2026-09-09",
    "2026-09-10",
    "2026-09-11",
    "2026-09-12",
    "2026-09-13",
    "2026-09-14",
    "2026-09-15",
    "2026-09-16",
    "2026-09-17",
    "2026-09-18",
    "2026-09-19",
    "2026-09-20",
    "2026-09-21",
    "2026-09-22",
    "2026-09-23",
    "2026-09-24",
    "2026-09-25",
    "2026-09-26",
    "2026-09-27",
    "2026-09-28",
    "2026-09-29",
    "2026-09-30",
    "2026-10-01",
    "2026-10-02",
    "2026-10-03",
    "2026-10-04",
    "2026-10-05",
    "2026-10-06",
    "2026-10-07",
    "2026-10-08",
    "2026-10-09",
    "2026-10-10",
    "2026-10-11",
    "2026-10-12",
    "2026-10-13",
    "2026-10-14",
    "2026-10-15",
    "2026-10-16",
    "2026-10-17",
    "2026-10-18",
    "2026-10-19",
    "2026-10-20",
    "2026-10-21",
    "2026-10-22",
    "2026-10-23",
    "2026-10-24",
    "2026-10-25",
    "2026-10-26",
    "2026-10-27",
    "2026-10-28",
    "2026-10-29"
  ],
  "closes": [
    337.3,
    336.42,
    338.22,
    336.63,
    337.8,
    330.02,
    335.32,
    335.98,
    335.31,
    337.13,
    339.27,
    339.86,
    344.81,
    352.1,
    357.28,
    357.42,
    359.2,
    363.63,
    361.96,
    354.02,
    358.66,
    359.26,
    356.44,
    355.34,
    352.87,
    354.29,
    350.45,
    357.04,
    352.62,
    352.72,
    356.06,
    353.97,
    357.48,
    356.87,
    362.92,
    366.32,
    369.67,
    366.51,
    364.42,
    367.47,
    367.49,
    365.35,
    361.7,
    366.92,
    367.13,
    366.0,
    365.45,
    370.21,
    365.68,
    366.22,
    365.78,
    366.84,
    366.83,
    369.55,
    368.49,
    373.8,
    373.61,
    379.75,
    373.54,
    372.93,
    357.77,
    354.85,
    358.57,
    356.08,
    359.94,
    362.13,
    360.77,
    359.51,
    357.34,
    358.62,
    356.91,
    344.93,
    349.64,
    357.25,
    361.16,
    357.01,
    356.33,
    351.12,
    350.79,
    342.1,
    343.47,
    345.22,
    345.19,
    340.02,
    342.61,
    337.64,
    340.1,
    340.62,
    337.59,
    337.11,
    334.92,
    336.54,
    347.14,
    346.08,
    347.66,
    340.73,
    335.28,
    334.78,
    342.32,
    344.86,
    346.8,
    351.2,
    346.71,
    341.65,
    339.09,
    336.18,
    346.38,
    349.7,
    349.96,
    353.61,
    358.09,
    363.37,
    363.92,
    360.02,
    356.22,
    363.39,
    367.35,
    373.14,
    366.52,
    366.02,
    366.6,
    361.18,
    358.85,
    360.79,
    362.98,
    368.71,
    364.44,
    360.92,
    355.97,
    363.03,
    361.77,
    364.07,
    369.73,
    371.95,
    366.72,
    366.4,
    373.05,
    373.42,
    383.24,
    384.3,
    384.13,
    385.67,
    388.94,
    380.96,
    375.67,
    376.3,
    379.36,
    384.68,
    381.64,
    375.02,
    370.19,
    371.94,
    373.91,
    376.08,
    376.04,
    376.82,
    378.99,
    372.94,
    369.6,
    366.35,
    358.22,
    358.1,
    356.18,
    356.78,
    356.89,
    358.56,
    356.27,
    352.45,
    358.2,
    354.27,
    354.57,
    354.81,
    351.56,
    355.66,
    355.82,
    360.13,
    364.01,
    363.39,
    369.73,
    363.86,
    360.82,
    362.36,
    363.3,
    363.74,
    369.11,
    368.75,
    365.22,
    369.9,
    370.05,
    371.78,
    370.3,
    375.69,
    376.51,
    376.1,
    373.21,
    371.39,
    373.78,
    374.0,
    369.96,
    376.18,
    377.03,
    378.2,
    376.14,
    371.43,
    372.17,
    375.94,
    375.43,
    377.06,
    377.39,
    372.26,
    364.84,
    364.48,
    362.04,
    362.57,
    364.05,
    360.94,
    359.92,
    362.29,
    364.19,
    359.76,
    361.38,
    359.71,
    361.49,
    354.89,
    356.15,
    357.0,
    352.93,
    355.07,
    352.74,
    359.41,
    359.53,
    359.89,
    359.0,
    357.7,
    358.79,
    365.57,
    360.79,
    358.3,
    357.84,
    356.03,
    355.52,
    359.55,
    366.18,
    369.29,
    364.67,
    365.17,
    371.48,
    373.45,
    381.85,
    384.83,
    384.96,
    385.15
  ],
  "opens": [
    337.3,
    336.59,
    337.88,
    335.77,
    336.99,
    330.81,
    334.68,
    335.82,
    335.08,
    335.57,
    339.2,
    339.16,
    344.48,
    351.82,
    356.22,
    357.11,
    359.85,
    364.18,
    362.04,
    353.82,
    357.66,
    359.29,
    357.19,
    354.51,
    353.38,
    353.71,
    350.79,
    357.26,
    351.92,
    352.42,
    355.4,
    354.18,
    357.41,
    356.3,
    363.41,
    366.45,
    368.96,
    366.19,
    364.05,
    368.42,
    368.4,
    364.92,
    362.17,
    367.2,
    368.14,
    366.7,
    365.76,
    370.66,
    365.14,
    365.38,
    365.18,
    365.95,
    366.93,
    368.91,
    368.38,
    374.27,
    373.64,
    379.59,
    373.77,
    372.3,
    357.44,
    353.36,
    357.73,
    356.6,
    360.27,
    362.57,
    360.78,
    359.51,
    357.83,
    358.81,
    357.56,
    345.92,
    349.6,
    357.26,
    361.79,
    357.59,
    356.15,
    350.53,
    350.82,
    341.61,
    341.86,
    345.42,
    345.96,
    340.82,
    342.36,
    337.74,
    340.79,
    340.29,
    337.6,
    337.72,
    334.22,
    336.52,
    347.73,
    346.03,
    348.21,
    341.58,
    335.65,
    334.61,
    342.12,
    342.78,
    346.28,
    350.91,
    346.77,
    341.61,
    339.73,
    336.78,
    346.18,
    349.17,
    349.41,
    354.26,
    357.18,
    364.45,
    364.19,
    359.02,
    355.74,
    363.5,
    367.29,
    372.29,
    366.5,
    366.5,
    366.55,
    360.71,
    358.45,
    360.6,
    362.67,
    368.67,
    364.8,
    360.86,
    357.12,
    363.27,
    361.79,
    364.15,
    368.66,
    372.08,
    366.71,
    367.07,
    373.11,
    373.42,
    383.5,
    384.28,
    384.55,
    386.4,
    388.29,
    380.92,
    375.72,
    376.74,
    379.15,
    383.74,
    381.44,
    374.08,
    371.83,
    371.63,
    374.18,
    376.16,
    374.37,
    377.35,
    379.28,
    373.29,
    369.06,
    366.28,
    357.62,
    358.3,
    355.97,
    356.67,
    357.52,
    358.47,
    355.13,
    352.91,
    357.69,
    355.01,
    353.37,
    355.34,
    350.65,
    355.72,
    356.67,
    359.75,
    363.43,
    364.48,
    369.59,
    365.03,
    360.83,
    361.86,
    363.03,
    363.51,
    367.81,
    368.5,
    364.95,
    369.92,
    369.12,
    371.88,
    369.08,
    374.45,
    375.62,
    376.56,
    374.28,
    370.54,
    374.76,
    373.46,
    370.37,
    376.15,
    377.04,